doc_id,pb_folder,source_folder,language,language_confidence,abstract_length,clean_abstract_length,file_name
b39624d6c38a,1 - Climate Change,No SDG,en,0.999995768467437,1062,1062,The role of hydrological modelling uncertainties in climate change impact assessments of Irish river catchments.pdf
d7b8d727bf7f,1 - Climate Change,No SDG,en,0.9999978148276928,1530,1530,Residential Water Scarcity in Cyprus_ Impact of Climate Change and Policy Options.pdf
98b2994454de,1 - Climate Change,SDG14,en,0.9999955840388218,1465,1465,Determination of the optimum MM5 configuration for long term CMAQ simulations of aerosol bound pollutants in Europe.pdf
36709684add1,1 - Climate Change,No SDG,en,0.9999962641810624,1229,1229,Climate Change Adaptation and Resilience through Big Data.pdf
78da21206ecf,1 - Climate Change,No SDG,en,0.9999982390615284,1057,1057,Coupled simulations of Greenland Ice Sheet and climate change up to A.D. 2300.pdf
d76008c84359,1 - Climate Change,SDG14,en,0.9999970062227036,2303,2303,On the Specification of Upward-Propagating Tides for ICON Science Investigations.pdf
93373d6e7b19,1 - Climate Change,No SDG,en,0.999997778504304,2526,2526,Gender Specific Reproductive Strategies of an Arctic Key Species (Boreogadus saida) and Implications of Climate Change.pdf
29debbd71958,1 - Climate Change,SDG10,en,0.9999973419328114,611,611,The Artist is Absent_ Non-Human Agency in the Situation of the Theatre _ Puuduv kunstnik_ mitte-inimese agentsus teatri kontekstis.pdf
580cb1753b80,1 - Climate Change,No SDG,en,0.9999976828108216,2941,2941,Climate Change Impact on Neotropical Social Wasps.pdf
a120afb4a1c8,1 - Climate Change,No SDG,en,0.9999978934850112,1739,1739,Long-term sustainability of large water resource systems under climate change_ A cascade modeling approach.pdf
8581e74341ad,1 - Climate Change,SDG14,en,0.999997387814176,2048,2048,"Variabilities in PM2.5 and Black Carbon Surface Concentrations Reproduced by Aerosol Optical Properties Estimated by In-Situ Data, Ground Based Remote Sensing and Modeling.pdf"
28fc0527bdb6,1 - Climate Change,No SDG,en,0.9999974192751518,966,966,Climate Change Impacts on Nutrient and Sediment Loads in a Midwestern Agricultural Watershed.pdf
03c55a425a95,1 - Climate Change,SDG13,en,0.9999950017244535,1047,1047,Weakening of the global atmospheric circulation with global warming.pdf
19351603671b,1 - Climate Change,SDG14,en,0.9999966788522654,1349,1349,The effect of mountain uplift on eastern boundary currents and upwelling systems.pdf
8d8ab7ed834f,1 - Climate Change,No SDG,en,0.9999991926788816,2047,2047,The potential impact of climate change on Australia's soil organic carbon resources.pdf
beff7875a219,1 - Climate Change,SDG7,en,0.999997028315778,1355,1355,Using Observed and Modelled Heat Fluxes for Improved Extrapolation of Wind Distributions.pdf
b6a915f0d851,1 - Climate Change,SDG14,en,0.9999980737844536,1476,1476,The Teleconnection between the Western Indian and the Western Pacific Oceans.pdf
9de7c20cae29,1 - Climate Change,SDG10,en,0.9999977732527308,1333,1333,The Yi-Jing Cosmic Model_ With an Application of an Alternative to Neoliberalism.pdf
7eeabf2d3241,1 - Climate Change,No SDG,en,0.99999714206139,523,523,The response of the Greenland ice sheet to climate changes in the 21st century by interactive coupling of an AOGCM with a thermomechanical ice-sheet model.pdf
6886331b8e6b,1 - Climate Change,No SDG,en,0.9999955754082308,883,883,Climate Change and Cerebrospinal Meningitis in the Ghanaian Meningitis Belt.pdf
ce913c076934,1 - Climate Change,SDG14,en,0.9999954417754672,946,946,Possible mechanisms of summer cirrus clouds over the Tibetan Plateau.pdf
1740ef2090f3,1 - Climate Change,SDG4,en,0.9999973800470072,1258,1258,Education for Religion_ An Islamic Perspective.pdf
3fe336e617f1,1 - Climate Change,SDG11,en,0.9999956882137676,830,830,Shifting forward_ Urban ecology in perspective.pdf
18f470198b8c,1 - Climate Change,SDG2,en,0.9999974417811728,1204,1204,Sympoietic growth_ living and producing with fungi in times of ecological distress.pdf
fe967180e692,1 - Climate Change,SDG6,en,0.9999970793765828,2722,2722,"Observations of precipitable water vapour over complex topography of Ethiopia from ground-based GPS, FTIR, radiosonde and ERA-Interim reanalysis.pdf"
3ee3257f98aa,1 - Climate Change,SDG14,en,0.9999947018819876,1405,1405,"CanStoc_ A Hybrid Stochastic–GCM System for Monthly, Seasonal and Interannual Predictions.pdf"
474b020c0a64,1 - Climate Change,SDG8,en,0.9999966091950157,719,719,"Environment, social & governance (ESG)_ A new world for Work and Organizational Psychologists.pdf"
7442a2ecd66d,1 - Climate Change,SDG13,en,0.999995742104212,1449,1449,Cities and Global Governance_ State Failure or a New Global Order_.pdf
6898e4408f2d,1 - Climate Change,SDG12,en,0.9999967356170296,1822,1822,What Is a Sustainable Level of Timber Consumption in the EU_ Toward Global and EU Benchmarks for Sustainable Forest Use.pdf
208027c43162,1 - Climate Change,SDG2,en,0.9999960591365308,1734,1734,"Agroecological break out_ Legumes, crop diversification and the regenerative futures of UK agriculture.pdf"
9e9a5ab8dfbb,1 - Climate Change,SDG4,en,0.9999980016355304,973,973,Computer Musicking as Onto-Epistemic Playground On the Joy of Developing Complexity Literacy and Learning to Let Others Be.pdf
a68053b3640c,1 - Climate Change,No SDG,en,0.9999955496603852,2434,2434,"The Tragedy of the Risk-Perception Commons_ Culture Conflict, Rationality Conflict, and Climate Change.pdf"
1e8b414ba8f4,1 - Climate Change,SDG11,en,0.9999973653380884,676,676,The Global Brain_ Beyond The Correlationist Paradigm In Architecture.pdf
2ecf59d6bada,1 - Climate Change,No SDG,en,0.9999961764927576,536,536,The timing of unprecedented hydrological drought under climate change.pdf
ff6fb1e2be19,1 - Climate Change,No SDG,en,0.999998008502366,1410,1410,Climate Changes and Food Quality_ The Potential of Microbial Activities as Mitigating Strategies in the Wine Sector.pdf
210ec884925e,1 - Climate Change,No SDG,en,0.9999980471602328,1303,1303,Climate Change in Jordan_ A Comprehensive Examination Approach.pdf
f2b093b5dab6,1 - Climate Change,No SDG,en,0.9999953780921622,1110,1110,Challenging claims in the study of migratory birds and climate change.pdf
766deda36a8c,1 - Climate Change,No SDG,en,0.9999974130825766,2499,2499,Climate change and population dynamics during the late Mesolithic and the Neolithic transition in Iberia.pdf
efd5f2ab32ee,1 - Climate Change,SDG13,en,0.9999969949385268,1355,1355,Earth's energy imbalance and implications.pdf
30128f5c44d7,1 - Climate Change,No SDG,en,0.9999970677244042,738,738,"Vulnerability, Income Growth and Climate Change.pdf"
44cb9ddc20a6,1 - Climate Change,No SDG,en,0.9999972885568916,1380,1380,Arctic climate change_ observed and modelled temperature and sea-ice variability.pdf
534e250445bb,1 - Climate Change,No SDG,en,0.9999974999952776,1374,1374,The state of the world’s mangroves in the 21st century under climate change.pdf
10e173ef6f1b,1 - Climate Change,SDG10,en,0.9999957377395636,1189,1189,Une contribution à la bioéthisation de la philosophie de Paulo Freire.pdf
d8298679cc6b,1 - Climate Change,No SDG,en,0.9999988594831822,1493,1493,Impact of Agricultural Supports for Climate Change Adaptation_ A Farm Level Assessment.pdf
66aa9d81a9f1,1 - Climate Change,No SDG,en,0.9999971014985518,3789,3789,Comparison of the impacts of urban development and climate change on exposing European cities to pluvial flooding.pdf
ffa6a29d70ef,1 - Climate Change,SDG14,en,0.9999969273815024,2013,2013,Exploring strategies for coupled 4D-Var data assimilation using an idealised atmosphere–ocean model.pdf
66c33f8c27ad,1 - Climate Change,No SDG,en,0.9999962597064174,1598,1598,The Social Costs of Climate Change_ The IPCC Second Assessment Report and Beyond.pdf
5194c7c1714e,1 - Climate Change,No SDG,en,0.9999976905659368,1119,1119,Climate change and spring-fruiting fungi.pdf
6810d3685389,1 - Climate Change,SDG11,en,0.9999965932779896,644,644,Measurement of boundary layer ozone concentrations on‐board a Skywalker unmanned aerial vehicle.pdf
b888b6091e7a,1 - Climate Change,SDG14,en,0.9999974120033536,584,584,Increasing deep-water overflow from the Pacific into the South China Sea revealed by mooring observations.pdf
08cdfd265a90,1 - Climate Change,No SDG,en,0.9999960785552338,2310,2310,"Climate Change Awareness in Mpumalanga Province, South Africa.pdf"
7428b52f8a0a,1 - Climate Change,No SDG,en,0.999997859560804,1410,1410,Impact of dams and climate change on suspended sediment flux to the Mekong delta.pdf
ff153d55d5fd,1 - Climate Change,SDG15,en,0.9999974210235508,933,933,"Preventive Medicine for Person, Place, and Planet_ Revisiting the Concept of High-Level Wellness in the Planetary Health Paradigm.pdf"
c74e926f78ca,1 - Climate Change,SDG14,en,0.9999967911582324,1163,1163,Pantasma_ Evidence for a Pleistocene circa 14 km diameter impact crater in Nicaragua.pdf
a5ae21ed27ee,1 - Climate Change,No SDG,en,0.9999956570408208,2096,2096,Impacts of climate change on hydropower generation in China.pdf
a3d6daa1a396,1 - Climate Change,SDG1,en,0.9999958362463446,703,703,Economic and social vulnerability because of Covid-19_ poverty and food security.pdf
74b721286485,1 - Climate Change,SDG11,en,0.9999971552814804,1158,1158,"Variations in Ozone Concentration over the Mid-Latitude Region Revealed by Ozonesonde Observations in Pohang, South Korea.pdf"
014a2c6f3d0f,1 - Climate Change,SDG2,en,0.9999981385626991,1212,1212,Environmental ethics and future oriented transformation to sustainability in Sub-Saharan Africa.pdf
f4bc536b4dd5,1 - Climate Change,SDG15,en,0.9999966780096126,1279,1279,Marketing the Market_ The Ideology of Market Mechanisms for Biodiversity Conservation.pdf
94cef8405b6e,1 - Climate Change,No SDG,en,0.9999951356792416,2121,2121,Sustainable Agro-Food Systems for Addressing Climate Change and Food Security.pdf
eaf6d52d5457,1 - Climate Change,SDG13,en,0.9999958404789916,2466,2466,Sensitivity of precipitation and atmospheric low-level circulation patterns to domain size and choice of parameterization schemes in RegCM4.4 over Central America.pdf
99e5b1ba5ba5,1 - Climate Change,SDG17,en,0.9999953280368694,1056,1056,"Retrospective analysis of published hydrological researches_ models, trends and geographical aspects over the last two decades of hydrological modelling.pdf"
11e601dd40d6,1 - Climate Change,SDG7,en,0.9999952271636484,1564,1564,Outlook for Offshore Wind Energy Development in Mexico from WRF Simulations and CMIP6 Projections.pdf
7ecf1c6c41d4,1 - Climate Change,No SDG,en,0.9999974657420014,1625,1625,The role of proteomics in the study of the influence of climate change on seafood products.pdf
ef8406385ab8,1 - Climate Change,No SDG,en,0.9999960642057052,6650,6650,"Separating climate change signals into thermodynamic, lapse-rate and circulation effects_ theory and application to the European summer climate.pdf"
da09c322b4d6,1 - Climate Change,SDG4,en,0.9999950287177592,788,788,Achieving a Common Future for all Through Sustainability-Conscious Legal Education and Research Methods.pdf
6c010d27c9e2,1 - Climate Change,No SDG,en,0.9999971924607874,1679,1679,From days to decades_ numerical modelling of freshwater lens response to climate change stressors on small low-lying islands.pdf
eedd0be5f6b2,1 - Climate Change,No SDG,en,0.9999958778543532,2496,2496,Responses to climate change in avian migration timemicroevolution versus phenotypic plasticity.pdf
3a2f7fb54bc1,1 - Climate Change,SDG11,en,0.9999961732517002,804,804,Urbanizing physical geography.pdf
0c8019e3495d,1 - Climate Change,SDG14,en,0.9999972578049028,1195,1195,Rapid response of the East Australian Current to remote wind forcing_ The role of barotropic-baroclinic interactions.pdf
fdfcb7e01e11,1 - Climate Change,SDG1,en,0.9999987263133174,577,577,Living In A Broken World Destructive Desire Disconnected Disciplinarity And Disruptive Deschooling.pdf
7a0615acd999,1 - Climate Change,SDG10,en,0.999995733652592,1163,1163,Is There an Alternative to Moderate Scientism_.pdf
76d10b9fd6c0,1 - Climate Change,SDG12,en,0.9999973761576708,1376,1376,Analysis of the Scale of Global Human Needs and Opportunities for Sustainable Catalytic Technologies.pdf
ca6e200d678b,1 - Climate Change,SDG6,en,0.999997056312685,1585,1585,Variability in the speed of the Brewer–Dobson circulation as observed by Aura_MLS.pdf
d15da82aa088,1 - Climate Change,SDG17,en,0.9999975290959938,2015,2015,Envisioning just transformations in and beyond the EU bioeconomy_ inspirations from decolonial environmental justice and degrowth.pdf
3f68844ce318,1 - Climate Change,SDG10,en,0.9999974231303204,615,615,Discovery of Geospatial Discriminating Patterns from Remote Sensing Datasets.pdf
c21a0b99e259,1 - Climate Change,No SDG,en,0.9999962646193457,1569,1569,Improving the validation of model-simulated crop yield response to climate change_ an application to the EPIC model.pdf
dc92c037bb1e,1 - Climate Change,SDG13,en,0.9999932093293084,1226,1226,Climate Feedback on Aerosol Emission and Atmospheric Concentrations.pdf
01a43c4718f6,1 - Climate Change,SDG9,en,0.9999973196254194,539,539,Architecture for More-than-Humans.pdf
dbde52e667aa,1 - Climate Change,No SDG,en,0.9999969087157724,1267,1267,Climate Change in the North Pacific Using Ice-Rafted Detritus as a Climatic Indicator.pdf
85cec6c7baf2,1 - Climate Change,SDG11,en,0.999997307719261,1477,1477,Seasonal and Spatial Characteristics of Urban Heat Islands (UHIs) in Northern West Siberian Cities.pdf
af45c4594116,1 - Climate Change,No SDG,en,0.9999954065462078,1364,1364,Recent Advances in Understanding the Effects of Climate Change on Coral Reefs.pdf
e181d0fa46d4,2 - Ocean Acidification,No SDG,en,0.9999975573041112,1150,1150,How will Ocean Acidification Affect Baltic Sea Ecosystems_ An Assessment of Plausible Impacts on Key Functional Groups.pdf
6a30de3dc038,1 - Climate Change,No SDG,en,0.9999970830502648,808,808,Tamm Review_ Observed and projected climate change impacts on Russia’s forests and its carbon balance.pdf
01a70dbf979d,2 - Ocean Acidification,No SDG,en,0.9999960226212724,2000,2000,"Influence of dispersal processes on the global dynamics of Emperor penguin, a species threatened by climate change.pdf"
6b989f0c288f,2 - Ocean Acidification,No SDG,en,0.9999979932932468,2497,2497,Elevated level of carbon dioxide affects metabolism and shell formation in oysters Crassostrea virginica (Gmelin).pdf
350950a0c141,2 - Ocean Acidification,No SDG,en,0.9999953021452528,2708,2708,"Calcification, Storm Damage and Population Resilience of Tabular Corals under Climate Change.pdf"
f7a7e03546d8,2 - Ocean Acidification,No SDG,en,0.9999954109388836,7085,7085,Seasonal changes in bacterioplankton nutrient limitation and their effects on bacterial community composition in the NW Mediterranean Sea.pdf
e0b506467515,2 - Ocean Acidification,No SDG,en,0.9999943436684352,569,569,"Carbonate system distribution, anthropogenic carbon and acidification in the western tropical South Pacific (OUTPACE 2015 transect).pdf"
189422b60b95,2 - Ocean Acidification,No SDG,en,0.9999949502133966,2130,2130,Evaluation of coral reef carbonate production models at a global scale.pdf
733ba5fc919b,2 - Ocean Acidification,No SDG,en,0.999997007945268,691,691,"Dissolved Oxygen and pH Dynamics Coupled to Photosynthesis in Huntington Bay, Western Long Island Sound.pdf"
3b43a79675de,2 - Ocean Acidification,No SDG,en,0.9999959732552618,1668,1668,Conceptualising change in marine governance_ Learning from Transition Management.pdf
6b07fa180443,2 - Ocean Acidification,No SDG,en,0.999995342444606,2906,2906,"Ecosystem-based marine spatial management_ Review of concepts, policies, tools, and critical issues.pdf"
9c24499b3b82,2 - Ocean Acidification,No SDG,en,0.999996228273794,3472,3472,Microbial Ecology of Four Coral Atolls in the Northern Line Islands.pdf
e0e6d223df20,2 - Ocean Acidification,No SDG,en,0.9999976717686422,1579,1579,"Cold-Water Coral Reefs in the Langenuen Fjord, Southwestern Norway—A Window into Future Environmental Change.pdf"
a0befd076648,2 - Ocean Acidification,No SDG,en,0.9999986437654578,1045,1045,Climate policy under uncertainty_ a case for solar geoengineering.pdf
44d5ec3427e9,2 - Ocean Acidification,No SDG,en,0.999996495681724,2440,2440,"The effects of light, macronutrients, trace metals and CO2 on the production of calcium carbonate and organic carbon in coccolithophores—A review.pdf"
f0309a8cfcb7,2 - Ocean Acidification,No SDG,en,0.9999958590044976,5234,5234,Impact of medium-term exposure to CO2 enriched seawater on the physiological functions of the velvet swimming crab Necora puber.pdf
6d34726fa878,2 - Ocean Acidification,No SDG,en,0.9999961973862296,2080,2080,Ocean acidification decreases plankton respiration_ evidence from a mesocosm experiment.pdf
183cf2fb0b80,2 - Ocean Acidification,No SDG,en,0.99999758791416,2823,2823,Twenty-five years of continuous sulphur dioxide emission reduction in Europe.pdf
01137eac8211,2 - Ocean Acidification,No SDG,en,0.9999956214707324,792,792,Thermal plasticity of growth and chain formation of the dinoflagellates Alexandrium affine and Alexandrium pacificum with respect to ocean acidification.pdf
82b2779f08ea,2 - Ocean Acidification,No SDG,en,0.9999986719413106,3337,3337,Effects of Ocean Acidification and Temperature Increases on the Photosynthesis of Tropical Reef Calcified Macroalgae.pdf
6a837d6f3c98,2 - Ocean Acidification,No SDG,en,0.9999959869571876,557,557,Coral and reef fish community recovery following the 2010 extreme ocean warming event (mass bleaching event) at Thailand.pdf
d0e67d561685,2 - Ocean Acidification,No SDG,en,0.999997568384788,6491,6491,Interactive effects of ocean acidification and nitrogen limitation on two bloom-forming dinoflagellate species.pdf
23aa02497362,2 - Ocean Acidification,No SDG,en,0.9999967991764964,1871,1871,Carbonate system parameters of an algal-dominated reef along West Maui.pdf
de8683ab9d65,2 - Ocean Acidification,No SDG,en,0.9999950090847752,1525,1525,An Assessment of Direct Dissolved Inorganic Carbon Injection to the Coastal Region_ A Model Result.pdf
fa1f553e04c9,2 - Ocean Acidification,No SDG,en,0.9999975798346434,964,964,High diversity of coralline algae in New Zealand revealed_ Knowledge gaps and implications for future research.pdf
caa0f4f9200b,2 - Ocean Acidification,No SDG,en,0.9999967973884328,2064,2064,Prey density in non-breeding areas affects adult survival of black-legged kittiwakes Rissa tridactyla.pdf
b38aa34795ba,2 - Ocean Acidification,No SDG,en,0.9999986809359204,740,740,Intense and widespread seismicity during the end-Triassic mass extinction due to emplacement of a large igneous province.pdf
9b381dcc3d43,2 - Ocean Acidification,No SDG,en,0.999996106733337,2400,2400,A framework to assess national level vulnerability from the perspective of food security_ The case of coral reef fisheries.pdf
958e8ae09926,2 - Ocean Acidification,No SDG,en,0.9999978888710812,723,723,Warming Alters Expressions of Microbial Functional Genes Important to Ecosystem Functioning.pdf
d175979dd9ca,2 - Ocean Acidification,No SDG,en,0.9999957142879112,1443,1443,Gene network analyses support subfunctionalization hypothesis for duplicated hsp70 genes in the Antarctic clam.pdf
d84d0ce7a4c8,2 - Ocean Acidification,No SDG,en,0.9999943113372548,3029,3029,Effects of ocean acidification on the immune response of the blue mussel Mytilus edulis.pdf
89b809c41b06,2 - Ocean Acidification,No SDG,en,0.9999973692671552,628,628,Physiological responses of Atlantic cod to climate change indicate that coastal ecotypes may be better adapted to tolerate ocean stressors.pdf
ab2d096a1aaf,2 - Ocean Acidification,No SDG,en,0.9999953890629252,681,681,Microbial and biogeochemical responses to projected future nitrate enrichment in the California upwelling system.pdf
15492fd35c65,2 - Ocean Acidification,No SDG,en,0.9999959998455352,1361,1361,Ocean acidification induces distinct metabolic responses in subtropical zooplankton under oligotrophic conditions and after simulated upwelling.pdf
43e194ce92e5,2 - Ocean Acidification,No SDG,en,0.9999981736368656,866,866,Prioritizing Land and Sea Conservation Investments to Protect Coral Reefs.pdf
84915f5956b8,2 - Ocean Acidification,No SDG,en,0.999997042621136,2467,2467,Precision pH Sensor Based on WO3 Nanofiber-Polymer Composites and Differential Amplification.pdf
912386399606,2 - Ocean Acidification,No SDG,en,0.9999953178522168,932,932,Assessing Long-Term Changes in the Beach Width of Reef Islands Based on Temporally Fragmented Remote Sensing Data.pdf
3d9b79c2d2f4,2 - Ocean Acidification,No SDG,en,0.9999951970585524,2494,2494,Possible effects of ocean acidification on coral reef biogeochemistry_ topics for research.pdf
bc9a0faaebc2,2 - Ocean Acidification,No SDG,en,0.9999947297905892,1290,1290,EAT BREATHE EXCRETE REPEAT_ Physiological Responses of the Mussel Mytilus galloprovincialis to Diclofenac and Ocean Acidification.pdf
ed840662a3c7,2 - Ocean Acidification,No SDG,en,0.999995793016228,1555,1555,Climate change and polar range expansions_ Could cuttlefish cross the Arctic_.pdf
7b536305dfc4,2 - Ocean Acidification,No SDG,en,0.9999958779004056,1814,1814,Physiological ecology meets climate change.pdf
d47b6132f4e3,2 - Ocean Acidification,No SDG,en,0.999998407604203,1571,1571,Aquavoltaics_ Synergies for dual use of water area for solar photovoltaic electricity generation and aquaculture.pdf
a941806942ed,2 - Ocean Acidification,No SDG,en,0.9999975179061164,789,789,Analysis of membrane proteins in metagenomics_ Networks of correlated environmental features and protein families.pdf
62ee400a4f10,2 - Ocean Acidification,No SDG,en,0.9999961098929055,1795,1795,Continental Climatic and Weathering Response to the Eocene-Oligocene Transition.pdf
b732442ba86b,2 - Ocean Acidification,SDG13,en,0.99999547174811,1553,1553,"An unsustainable modernity_ Democracy, the global climate emergency, and environmental ethics.pdf"
c4582701ea82,2 - Ocean Acidification,No SDG,en,0.9999950314978808,1540,1540,Characterization of an undocumented CO2 hydrothermal vent system in the Mediterranean Sea_ Implications for ocean acidification forecasting.pdf
5a872e7dc458,2 - Ocean Acidification,SDG14,en,0.999996416705574,1692,1692,"Sea Level Rise Will Drive Divergent Sediment Transport Patterns on Fore Reefs and Reef Flats, Potentially Causing Erosion on Atoll Islands.pdf"
75c4c92dcf6f,2 - Ocean Acidification,No SDG,en,0.999996864081644,1564,1564,Long-term Aptian marine osmium isotopic record of Ontong Java Nui activity.pdf
a31195146871,2 - Ocean Acidification,No SDG,en,0.9999960275877068,1073,1073,Biogeochemical implications of decomposing jellyfish blooms in a changing climate.pdf
0866b31f11c4,2 - Ocean Acidification,SDG13,en,0.9999971207188671,789,789,The Weird and the Meta in Jeff VanderMeer's Dead Astronauts.pdf
048ee543e326,2 - Ocean Acidification,No SDG,en,0.9999961417173724,1029,1029,Bleaching impacts on carbonate production in the Chagos Archipelago_ influence of functional coral groups on carbonate budget trajectories.pdf
9480a86811a3,2 - Ocean Acidification,No SDG,en,0.9999976206330472,3199,3199,Combining Natural History Collections with Fisher Knowledge for Community-Based Conservation in Fiji.pdf
9346ad93eabc,2 - Ocean Acidification,No SDG,en,0.9999979968758848,3125,3125,Species-specific effects of near-future CO2 on the respiratory performance of two tropical prey fish and their predator.pdf
8dab1f3514a4,2 - Ocean Acidification,No SDG,en,0.9999963198441508,809,809,The UN Decade of Ocean Science for Sustainable Development.pdf
63f770a7de49,2 - Ocean Acidification,No SDG,en,0.999997173614552,1015,1015,"Carbon-Based Metal-Free Electrocatalysis for Energy Conversion, Energy Storage, and Environmental Protection.pdf"
b37bc5954f95,2 - Ocean Acidification,No SDG,en,0.999995107924206,968,968,Phytoplankton Biogeography and Community Stability in the Ocean.pdf
12c2c9cdccde,2 - Ocean Acidification,No SDG,en,0.9999969762780796,1322,1322,Fouling communities from the South African west coast are vulnerable to cooling and ocean acidification.pdf
20d20e99e7ff,2 - Ocean Acidification,No SDG,en,0.999997813902984,1782,1782,"A Key Marine Diazotroph in a Changing Ocean_ The Interacting Effects of Temperature, CO2 and Light on the Growth of Trichodesmium erythraeum IMS101.pdf"
66c76ad14a95,2 - Ocean Acidification,No SDG,en,0.9999947088583384,1034,1034,Visualizing a Field of Research With Scientometrics_ Climate Change Associated With Major Aquatic Species Production in the World.pdf
06cdb4126b53,2 - Ocean Acidification,SDG14,en,0.9999968110069466,741,741,Future Opportunities in Scientific Ocean Drilling_ Illuminating Planetary Habitability.pdf
2fcf800f9b81,2 - Ocean Acidification,No SDG,en,0.9999949222370332,2496,2496,"Sensitivity of phytoplankton to future changes in ocean carbonate chemistry_ current knowledge, contradictions and research directions.pdf"
0d80435ed1f7,2 - Ocean Acidification,No SDG,en,0.9999980287496952,1014,1014,Limpets counteract ocean acidification induced shell corrosion by thickening of aragonitic shell layers.pdf
2b2223b51ee0,2 - Ocean Acidification,No SDG,en,0.9999965429025308,610,610,Climate change drives rapid decadal acidification in the Arctic Ocean from 1994 to 2020.pdf
2ec1561ee945,2 - Ocean Acidification,No SDG,en,0.9999977578346056,3101,3101,"Australian shellfish ecosystems_ Past distribution, current status and future direction.pdf"
836729823b1f,2 - Ocean Acidification,No SDG,en,0.9999964451898744,2496,2496,Otolith size and the vestibulo-ocular reflex of larvae of white seabass Atractoscion nobilis at high pCO2.pdf
9821a655ab99,2 - Ocean Acidification,No SDG,en,0.9999976610060344,1619,1619,Firm Sustainable Development Goals and Firm Financial Performance through the Lens of Green Innovation Practices and Reporting_ A Proactive Approach.pdf
