doc_id,pb_folder,source_folder,language,language_confidence,abstract_length,clean_abstract_length,file_name
697b132b1c14,6 - Land System Change,SDG12,en,0.999996983668815,1702,1702,"Recyclability, durability and water vapour adsorption of unstabilised and stabilised compressed earth bricks.pdf"
9ff360edc246,6 - Land System Change,No SDG,en,0.9999975690485372,1766,1766,Assessments of the Northern Hemisphere snow cover response to 1.5 and 2.0 °C warming.pdf
3bb86d3f1d44,6 - Land System Change,No SDG,en,0.999995139962316,1149,1149,"Kesiapan Petani Kelapa Sawit Swadaya dalam Implementasi ISPO_ Persoalan Lingkungan Hidup, Legalitas dan Keberlanjutan.pdf"
6fb501195f15,6 - Land System Change,No SDG,en,0.9999975518419691,830,830,"Pre-Columbian agricultural landscapes, ecosystem engineers, and self-organized patchiness in Amazonia.pdf"
bbf5ed8cca66,6 - Land System Change,No SDG,en,0.999996804080408,2232,2232,Early Lycophyte Evolution.pdf
7572eb048602,6 - Land System Change,No SDG,en,0.9999949404476828,3531,3531,Reviews and syntheses_ Arctic fire regimes and emissions in the 21st century.pdf
8e0c39744cf1,6 - Land System Change,SDG4,en,0.9999975870041224,605,605,Modern Hard SF_ Simulating Physics in Virtual Reality in Cixin Liu’s _The Three-Body Problem_.pdf
bed0040a5d4b,6 - Land System Change,No SDG,en,0.9999966658779892,2475,2475,Carbon Cycle Response to Temperature Overshoot Beyond 2°C_ An Analysis of CMIP6 Models.pdf
66189a5ecc14,6 - Land System Change,No SDG,en,0.9999972553965676,1289,1289,Development of an Indicator to Monitor Mediterranean Wetlands.pdf
362e76793312,6 - Land System Change,SDG1,en,0.9999968331693148,1535,1535,Infectious disease emergence and global change_ thinking systemically in a shrinking world.pdf
76eedd461af8,6 - Land System Change,SDG13,en,0.9999969929419894,2170,2170,Influence of the representation of convection on the mid-Holocene West African Monsoon.pdf
888d4516378f,6 - Land System Change,SDG13,en,0.8571418747889568,534,534,Commentaries on Top-Cited Boundary-Layer Meteorology Articles.pdf
6a3c77e2e3fb,6 - Land System Change,No SDG,en,0.9999965302620748,1829,1829,The Impact of Land Use Change on Perform (Soil-Water) System in Middle Part of Mesopotamian Plain.pdf
031e218eebb6,6 - Land System Change,No SDG,en,0.9999966882506128,985,985,Green areas in coastal cities – conflict of interests or stakeholders’ perspectives_.pdf
5a06ecb543ec,6 - Land System Change,No SDG,en,0.9999963834883634,620,620,"Monitoring Land Use Land Cover Changes and Modelling of Urban Growth Using a Future Land Use Simulation Model (FLUS) in Diyarbakır, Turkey.pdf"
f7d9712bf7ab,6 - Land System Change,No SDG,en,0.9999968733237116,1648,1648,Modelling Spatial and Temporal Forest Cover Change Patterns (1973-2020)_ A Case Study from South Western Ghats (India).pdf
f21bc832abc6,6 - Land System Change,No SDG,en,0.999994859071976,2274,2274,Disturbance type and species life history predict mammal responses to humans.pdf
37772efc4dff,6 - Land System Change,No SDG,en,0.9999967990950608,1854,1854,Validation and Spatiotemporal Analysis of CERES Surface Net Radiation Product.pdf
2cd777d13b06,6 - Land System Change,No SDG,en,0.9999952202743436,527,527,"Urbanization, Housing, Homelessness and Climate Change.pdf"
ccdd834c241f,6 - Land System Change,No SDG,en,0.9999966843525764,1926,1926,Nitrogen availability determines the long-term impact of land use change on soil carbon stocks in grasslands of southern Ghana.pdf
6a8b58fe4a7f,6 - Land System Change,No SDG,en,0.9999940855190456,2153,2153,"Climate change, wellbeing and resilience in the Weenusk First Nation at Peawanuck_ the Moccasin Telegraph goes global.pdf"
bc0e0fcc32f5,6 - Land System Change,SDG7,en,0.9999967003946246,1570,1570,A comparison of eddy-covariance and large aperture scintillometer measurements with respect to the energy balance closure problem.pdf
170f2b5e15e9,6 - Land System Change,No SDG,en,0.9999977408528476,1062,1062,Perubahan Penutupan Lahan Di Taman Nasional Way Kambas.pdf
04bf901fd941,6 - Land System Change,No SDG,en,0.9999959775193552,1532,1532,Sequestration potential of energy crop Miscanthus x giganteus cultivated in continental part of Croatia.pdf
9070bfafbafc,6 - Land System Change,No SDG,en,0.9999959631602864,1648,1648,Hi-sAFe_ A 3D Agroforestry Model for Integrating Dynamic Tree–Crop Interactions.pdf
9e1320ce502d,6 - Land System Change,SDG13,en,0.9999950183991698,1197,1197,Hurricane Forecasts with a Mesoscale Suite of Models.pdf
40f1744b97ea,6 - Land System Change,SDG5,en,0.9999962895455996,2497,2497,9 - Letter to René Devisch_ Kata Nomon.pdf
6d44492fc642,6 - Land System Change,No SDG,en,0.9999978489716788,1955,1955,Analyzing the Impact of Highways Associated with Farmland Loss under Rapid Urbanization.pdf
b707c0ae8308,6 - Land System Change,SDG1,en,0.999995571627018,1623,1623,Social Mobility_ Mithraism and Cosmography in the 2nd-5th Centuries CE.pdf
1964109f6b2c,6 - Land System Change,SDG11,en,0.999995464429813,668,668,Colouring Outside The Lines Methods For A Global History Of Eastern Eurasia 600 1350.pdf
9c540c6b7af5,6 - Land System Change,SDG7,en,0.9999971878615224,1516,1516,Investigating thermal properties of gas-filled planetary regoliths using a thermal probe.pdf
3e5fff353a4c,6 - Land System Change,SDG13,en,0.9999957986170156,824,824,Climatic conditions for emergence and flight of mountain pine beetle_ implications for long-distance dispersal.pdf
6c6f07be4ce2,7 - Biosphere Integrity,No SDG,en,0.9999973862908806,1633,1633,Reassessment of the Goiânia radioactive waste repository in Brazil using HYDRUS-1D.pdf
6ef0f7e089d7,7 - Biosphere Integrity,No SDG,en,0.9999978200690108,1060,1060,"Plant Antioxidants Affect Human and Gut Health, and Their Biosynthesis Is Influenced by Environment and Reactive Oxygen Species.pdf"
b71c95e19f2b,7 - Biosphere Integrity,No SDG,en,0.999997454775146,848,848,"Radioactive Waste Classification, Management and Environment.pdf"
4e5bf91dbd9b,7 - Biosphere Integrity,No SDG,en,0.9999974592555632,781,781,The biofilm life cycle and virulence of Pseudomonas aeruginosa are dependent on a filamentous prophage.pdf
70b444b24323,7 - Biosphere Integrity,No SDG,en,0.9999959714223604,1187,1187,An Eco-GAME Meta-Evaluation of Existing Methods for the Appreciation of Ecosystem Services.pdf
e0ad3bd5bce4,7 - Biosphere Integrity,No SDG,en,0.9999973451907708,2796,2796,"The Scientific Management of Temperate Conamunities for Conservation_ The 31st Symposium of the British Ecological Society, Southampton, 1989.pdf"
61474665c980,7 - Biosphere Integrity,No SDG,en,0.9999953802877294,875,875,Education_ 7. Integrality of Musical Education Lesson – Praxeological Perspectives.pdf
60d01c43b9e3,7 - Biosphere Integrity,No SDG,en,0.9999971695417104,1117,1117,Methodology for Monitoring Sustainable Development of Isolated Microgrids in Rural Communities.pdf
ca78a4a6722b,7 - Biosphere Integrity,No SDG,en,0.9999978519258312,886,886,An Analysis of the Worldwide Research on the Socio-Cultural Valuation of Forest Ecosystem Services.pdf
d7173924a6cb,7 - Biosphere Integrity,No SDG,en,0.9999990194701536,1715,1715,"The Change of Secondary School Students’ Environmental Consciousness, Attitude and Behaviors with Nature Education Project.pdf"
da529bff27e3,7 - Biosphere Integrity,No SDG,en,0.9999976344000676,2480,2480,Comparative proteome analysis of Milnesium tardigradum in early embryonic state versus adults in active and anhydrobiotic state.pdf
0f84341d7e44,7 - Biosphere Integrity,No SDG,en,0.9999985570592046,1020,1020,Scaling up area-based conservation to implement the Global Biodiversity Framework’s 30x30 target_ The role of Nature’s Strongholds.pdf
8a3d4a75e493,7 - Biosphere Integrity,No SDG,en,0.999996606567123,2499,2499,The need of an ethics of planetary sustainability.pdf
4fd4e6318f61,7 - Biosphere Integrity,No SDG,en,0.9999974917477594,626,626,Analysis of Plantation Management Achievement Based on Sustainable Development.pdf
5d4d91d5bf10,7 - Biosphere Integrity,No SDG,en,0.8571400034892056,2487,2487,The challenge of participatory restoration in rural areas.pdf
f9b78c03e5de,7 - Biosphere Integrity,No SDG,en,0.999995877092196,1523,1523,Indices for Measuring Forest Ecosystem Goods and Services Contribution to the Rural Community_ A Tool for Informed Decisions.pdf
2bc6489e5050,7 - Biosphere Integrity,No SDG,en,0.999997363940096,1910,1910,Unravelling cross-scale and cross-level challenges in Ethiopian forest and landscape restoration governance.pdf
715ccdf3110c,7 - Biosphere Integrity,No SDG,en,0.9999967980170058,829,829,Experimental Ecosystem Natural Capital Accounts In The Republic Of Guinea.pdf
691e52606885,7 - Biosphere Integrity,No SDG,en,0.9999988935334562,572,572,Dispersal network structure and infection mechanism shape diversity in a coevolutionary bacteria-phage system.pdf
6675089a712d,7 - Biosphere Integrity,No SDG,en,0.999997078251791,1481,1481,"Earth system governance_ Local cases, global options.pdf"
c631f8c72c06,7 - Biosphere Integrity,No SDG,en,0.9999976213554664,1320,1320,Sustainable Land Management and Climate Change Adaptation for Small-Scale Land Users in Sub-Saharan Africa.pdf
ed552423bc40,7 - Biosphere Integrity,No SDG,en,0.9999965706705072,1800,1800,Climate Change and Revisiting Security from Traditional State-Centric to Human Security and Beyond.pdf
fccd324046a4,7 - Biosphere Integrity,No SDG,en,0.9999969078421924,1014,1014,Structural diversity and ligand specificity of lectins. The Bangalore effort.pdf
4de1a4df4605,7 - Biosphere Integrity,No SDG,en,0.9999952828371914,851,851,Enhancing Rubisco gene expression and metabolites accumulation for better plant growth in Ficus deltoidea under drought stress using hydrogen peroxide.pdf
f48f61c0b25e,7 - Biosphere Integrity,No SDG,en,0.9999963668175188,604,604,A Landscape-Level Assessment of Restoration Resource Allocation for the Eastern Monarch Butterfly.pdf
bc44d167011e,7 - Biosphere Integrity,No SDG,en,0.9999970325856132,1200,1200,Sustainable Development_ A Bird’s Eye View.pdf
81b78ed9ee04,7 - Biosphere Integrity,No SDG,en,0.9999981547913412,2290,2290,Landscape without nature_ Ecological reflections in contemporary Chinese art.pdf
42b9b86fd279,7 - Biosphere Integrity,No SDG,en,0.9999959653402246,1583,1583,"Alien and Potentially Invasive Plants in Four Lagoons on the Island of Cozumel, Mexico.pdf"
915bef103e53,7 - Biosphere Integrity,SDG15,en,0.9999960842218732,2226,2226,Influence of contemporary warming on landscape-zonal systems of the East-European sub-continent_ Predictive empirical-statistical modeling.pdf
bde229bccfe8,7 - Biosphere Integrity,No SDG,en,0.9999981469983162,1864,1864,Responsibly Managing Risks To The Environment_ Stakeholders And Their Communication Contract.pdf
af1d7851e6cf,7 - Biosphere Integrity,No SDG,en,0.9999955842178526,1871,1871,Laudato Si’_ A Prophetic Message.pdf
6959052fd57a,7 - Biosphere Integrity,No SDG,en,0.9999980902323092,1562,1562,The influence of renewable energy and economic freedom aspects on ecological sustainability in the G7 countries.pdf
0b6c4f632499,7 - Biosphere Integrity,No SDG,en,0.9999991524411548,934,934,Human factors and ergonomics systems-based tools for understanding and addressing global problems of the twenty-first century.pdf
39972d033db0,7 - Biosphere Integrity,No SDG,en,0.9999960168078126,748,748,Psychological Processes and Institutional Actors in the Sustainable Energy Transition_ A Case-Study Analysis of a Local Community in Italy.pdf
b04f1061de65,7 - Biosphere Integrity,No SDG,en,0.9999968545317736,1042,1042,The meaning of life together and inter-relationship in business.pdf
1abd6b3d8d8b,7 - Biosphere Integrity,No SDG,en,0.999996367721825,1341,1341,"‘Rapid Scenario Planning’ to Support a Regional Sustainability Transformation Vision_ A Case Study from Blekinge, Sweden.pdf"
6ee767103eec,7 - Biosphere Integrity,No SDG,en,0.9999976633133318,587,587,Kindness in Architecture_ The Multispecies Co-Living and Co-Design.pdf
502672ef0ff4,7 - Biosphere Integrity,No SDG,en,0.9999967203869176,2497,2497,Judicial Review of the Administrative Record in NEPA Litigation.pdf
9ae57eb9ed76,7 - Biosphere Integrity,No SDG,en,0.999995729713655,923,923,Experiencing Values in the Flow of Events_ A Phenomenological Approach to Relational Values.pdf
692b15b9eaf9,7 - Biosphere Integrity,No SDG,en,0.99999940114328,1379,1379,Green Routes_ Exploring Protein-Based Virus-like Nanoparticle Transport and Immune Activation in Nicotiana benthamiana for Biotechnological Applications.pdf
351a5bb217b6,7 - Biosphere Integrity,No SDG,en,0.9999981561831291,3738,3738,Conservation after Sovereignty_ Deconstructing Australian Policies against Horses with a Plea and Proposal.pdf
13edd1ae98ee,7 - Biosphere Integrity,No SDG,en,0.9999968571404472,1141,1141,The importance for food security of maintaining rust resistance in wheat.pdf
f2e27a66537b,7 - Biosphere Integrity,No SDG,en,0.9999979872206078,2345,2345,Pesticide Applications-Threat to Ecosystems.pdf
f313216fbdec,7 - Biosphere Integrity,No SDG,en,0.9999963361929628,668,668,Metagenome-Assembled Genomes From Pyropia haitanensis Microbiome Provide Insights Into the Potential Metabolic Functions to the Seaweed.pdf
763c5ac1d0cb,7 - Biosphere Integrity,No SDG,en,0.999997992177236,709,709,An Analysis on Sustainable Development and Green Economy.pdf
72894fef9030,7 - Biosphere Integrity,No SDG,en,0.9999981151860894,1352,1352,"Thermal degradation of crab shell biomass, a nitrogen-containing carbon precursor.pdf"
ea5c8f049e7d,7 - Biosphere Integrity,No SDG,en,0.9999979283302388,2448,2448,The Moral Status of Animals.pdf
35fd920a006b,7 - Biosphere Integrity,No SDG,en,0.9999990639523332,1183,1183,Modern Approaches To Assessing The Impact Of Investment Projects On The Socio Economic System Of The Region.pdf
153727c1b243,7 - Biosphere Integrity,No SDG,en,0.9999970668817352,2628,2628,Just Pathways to Sustainability_ From Environmental Human Rights Defenders to Biosphere Defenders.pdf
24ebe8782829,7 - Biosphere Integrity,No SDG,en,0.9999957719950812,652,652,Becoming a Developed and Sustainable Destination_ La Siberia Biosphere Reserve in Spain.pdf
94c4a1b49c44,7 - Biosphere Integrity,No SDG,en,0.9999968811883502,828,828,Ecological resources of boreal forests in the adsorption of greenhouse gases and in adaptation to global warming.pdf
f1f51368d2e0,7 - Biosphere Integrity,No SDG,en,0.9999961141080904,1756,1756,Ecological Culture_ Extra-Evaluative Interpretation.pdf
161d58255d44,7 - Biosphere Integrity,No SDG,en,0.9999961912993484,1116,1116,δ18O of atmospheric oxygen measured on the GRIP Ice Core Document Stratigraphic disturbances in the lowest 10% of the core.pdf
a9a4050d6822,7 - Biosphere Integrity,No SDG,en,0.9999960839402272,804,804,Biomass functions for the two alien tree species Prunus serotina Ehrh. and Robinia pseudoacacia L. in floodplain forests of Northern Italy.pdf
9cfc99d2b19e,7 - Biosphere Integrity,No SDG,en,0.999996310211206,1731,1731,Natural Conservation Base on Management of Sacred Cultural Landscape of Catur Angga Batukaru Temple in Tabanan-Bali.pdf
42c958306230,7 - Biosphere Integrity,No SDG,en,0.9999979870966396,1581,1581,An evaluation of soil retention potential as an important factor of water balance in the landscape.pdf
2e3793d566e6,7 - Biosphere Integrity,No SDG,en,0.9999972890378936,789,789,"Crabrolin, a natural antimicrobial peptide_ structural properties.pdf"
6adf36ff1a69,7 - Biosphere Integrity,No SDG,en,0.9999977647715528,2937,2937,Alleviate The Adverse Effects Of Some Heavy Metals And Improve Quality And Storability Of Tomato And Kidney Bean Plants Grown Under Pollution Conditions.pdf
fe602af850ad,7 - Biosphere Integrity,No SDG,en,0.9999982607421286,648,648,Post-Closure Performance Assessment for Deep Borehole Disposal of Cs_Sr Capsules.pdf
0648e54a64e5,7 - Biosphere Integrity,No SDG,en,0.999995530882914,888,888,Environment under Reconstruction_ Environmental Law and Policy in the Democratic Republic of Congo.pdf
e3684b4b7703,7 - Biosphere Integrity,No SDG,en,0.9999961856624212,1123,1123,"Stormonth-Darling, John M; (2022) Developing tools and evidence to deliver prosperity_ optimising for prosperity with a meta-framework for change.pdf"
21ecc353ac74,7 - Biosphere Integrity,No SDG,en,0.9999978151597364,912,912,A Rights Turn in Biodiversity Litigation_.pdf
cb831c750a69,7 - Biosphere Integrity,SDG15,en,0.9999982283442926,1644,1644,Extinct flagships_ linking extinct and threatened species.pdf
abf0a4bd43b6,7 - Biosphere Integrity,No SDG,en,0.9999980573467432,1745,1745,Stakeholder perceptions of the benefits and barriers of implementing environmental management systems in the Maldivian construction industry.pdf
78dc23f39924,7 - Biosphere Integrity,No SDG,en,0.9999950888242912,1378,1378,Revisiting Biodiversity and Ecosystem Functioning through the Lens of Complex Adaptive Systems.pdf
a11dce9e9ed0,7 - Biosphere Integrity,No SDG,en,0.999995753688132,947,947,Knowing Our Enemy in the Antimicrobial Resistance Era_ Dissecting the Molecular Basis of Bacterial Defense Systems.pdf
5f1fc14637e3,7 - Biosphere Integrity,No SDG,en,0.999997581271014,712,712,The Politics of Land Use in the Korup National Park.pdf
5d9cbb3d18a7,7 - Biosphere Integrity,No SDG,en,0.9999966678728236,1575,1575,The Microplastics Cycle_ An In-Depth Look at a Complex Topic.pdf
c31e83132cdb,8 - Novel Entities,No SDG,en,0.9999947303252948,1806,1806,Bim Gis Integrated Geospatial Information Model Using Semantic Web And Rdf Graphs.pdf
0de67b184b6a,8 - Novel Entities,No SDG,en,0.9999966172507008,1818,1818,Few-shot Multi-domain Knowledge Rearming for Context-aware Defence against Advanced Persistent Threats.pdf
d8e32b257793,8 - Novel Entities,SDG14,en,0.9999944354622524,1287,1287,Relative contributions of tropospheric and stratospheric sources to nitrate in Antarctic snow.pdf
8c7353f7bbe2,8 - Novel Entities,SDG16,en,0.9999981809862124,1199,1199,"Toys for Conviviality. Situating Commoning, Computation and Modelling.pdf"
8a9d7e415fdd,7 - Biosphere Integrity,No SDG,en,0.9999959213674836,1965,1965,Forest Policy of Ethiopia from 1990 to 2020_ An Assessment of Contemporary Forest Management Approach and Its Impact on Local Livelihood.pdf
83d5fcfb63a6,8 - Novel Entities,No SDG,en,0.9999974875785944,1136,1136,Improved Opposition-Based Particle Swarm Optimization Algorithm for Global Optimization.pdf
44a7681e77fd,8 - Novel Entities,No SDG,en,0.9999972102890232,1142,1142,Phospholipase D_ molecular and cell biology of a novel gene family.pdf
c1aedd8b5cbf,8 - Novel Entities,SDG17,en,0.9999966468145444,621,621,Joint Discussion 8_ Large Telescopes and Virtual Observatory_ Visions for the Future.pdf
fd7c9736c65e,8 - Novel Entities,No SDG,en,0.9999979136134216,1351,1351,Current and Emerging Themes in the Structural Analysis of Viral RNA Genomes_ Applications for the Development of Novel Therapeutic Drugs.pdf
90702df348a9,8 - Novel Entities,No SDG,en,0.999997510506567,1410,1410,Next‐generation antimalarial drugs_ hybrid molecules as a new strategy in drug design.pdf
e08297aa7251,8 - Novel Entities,No SDG,en,0.9999945657135176,777,777,Character based String Kernels for Bio-Entity Relation Detection.pdf
bb758b998875,8 - Novel Entities,SDG13,en,0.9999960279520472,1658,1658,A new parameterization of ice heterogeneous nucleation coupled to aerosol chemistry in WRF-Chem model version 3.5.1_ evaluation through ISDAC measurements.pdf
12b645b93197,8 - Novel Entities,No SDG,en,0.9999988592157938,3238,3238,"Co-Administration of Resveratrol and Lipoic Acid, or Their Synthetic Combination, Enhances Neuroprotection in a Rat Model of Ischemia_Reperfusion.pdf"
003294d827f5,8 - Novel Entities,No SDG,en,0.9999974296459556,1139,1139,Towards measuring political rents in agriculture_ case studies of different agrarian structures in the EU.pdf
e362699b8fcf,8 - Novel Entities,SDG13,en,0.9999970075519954,1335,1335,The Impact of Mount Washington on the Height of the Boundary Layer and the Vertical Structure of Temperature and Moisture.pdf
eac718b2695f,8 - Novel Entities,No SDG,en,0.9999967509368444,1383,1383,Exploiting Graphic Card Processor Technology to Accelerate Data Mining Queries in SAP NetWeaver BIA.pdf
a26100c1def5,8 - Novel Entities,No SDG,en,0.9999948772458508,2427,2427,Synthetic lethal combinations of low-toxicity drugs for breast cancer identifiedin silicoby genetic screens in yeast.pdf
14f1cd40e61a,8 - Novel Entities,No SDG,en,0.9999947510872612,1641,1641,"Actors, Avatars and Agents_ Potentials and Implications of Natural Face Technology for the Creation of Realistic Visual Presence.pdf"
3e4c774aebec,8 - Novel Entities,No SDG,en,0.9999959243577274,1363,1363,Real‐time Anticipation of Occlusions for Automated Camera Control in Toric Space.pdf
f5293eba6034,8 - Novel Entities,No SDG,en,0.9999971638921452,1225,1225,Mixed Cerebrovascular Disease and the Future of Stroke Prevention.pdf
0796a651e554,8 - Novel Entities,No SDG,en,0.9999956794960648,1459,1459,Interleukin-17A promotes tongue squamous cell carcinoma metastasis through activating miR-23b_versican pathway.pdf
40ac846dc032,8 - Novel Entities,No SDG,en,0.9999967830966382,503,503,Chalcomoracin is a potent anticancer agent acting through triggering Oxidative stress via a mitophagy- and paraptosis-dependent mechanism.pdf
a6524d5c0b94,8 - Novel Entities,No SDG,en,0.9999974524702506,1006,1006,New Nuclear SNP Markers Unravel the Genetic Structure and Effective Population Size of Albacore Tuna (Thunnus alalunga).pdf
aa624c008b5e,8 - Novel Entities,SDG13,en,0.9999963260307444,537,537,Impact of present and future aircraft NOx and aerosol emissions on atmospheric composition and associated direct radiative forcing of climate.pdf
0fbceeeb661a,8 - Novel Entities,SDG16,en,0.9999971646800566,723,723,Explaining unification in physics internally.pdf
d88eea3c84a1,8 - Novel Entities,No SDG,en,0.9999976454273788,1202,1202,"Past, Present, and Future of Simultaneous Localization and Mapping_ Toward the Robust-Perception Age.pdf"
574655ad6195,8 - Novel Entities,SDG13,en,0.9999957669592456,722,722,Saharan dust events at the Jungfraujoch_ detection by wavelength dependence of the single scattering albedo and first climatology analysis.pdf
b98dbc59db77,8 - Novel Entities,No SDG,en,0.9999957494528604,2500,2500,On Organizational Becoming_ Rethinking Organizational Change.pdf
85872b4d05e3,8 - Novel Entities,No SDG,en,0.9999973725735836,1003,1003,A tool supported methodology to passively test asynchronous systems with multiple users.pdf
06b1c6343a08,8 - Novel Entities,No SDG,en,0.9999962105189172,1318,1318,Pslsh.pdf
2bdcfdc22bdf,8 - Novel Entities,No SDG,en,0.9999989996684912,2366,2366,"PI-RADS Prostate Imaging – Reporting and Data System_ 2015, Version 2.pdf"
55b594209ed5,8 - Novel Entities,No SDG,en,0.999995579882078,1332,1332,"A Survey on Metaverse_ Fundamentals, Security, and Privacy.pdf"
e4f4eaaf7dbd,8 - Novel Entities,No SDG,en,0.9999970853699004,1455,1455,A Lease Based Hybrid Design Pattern for Proper-Temporal-Embedding of Wireless CPS Interlocking.pdf
5649806bfdcb,8 - Novel Entities,No SDG,en,0.9999970300069952,1588,1588,A Fluorescence-based Lymphocyte Assay Suitable for High-throughput Screening of Small Molecules.pdf
86f81d458b73,8 - Novel Entities,No SDG,en,0.999997309398571,1794,1794,Reform.pdf
6f01ecadd134,8 - Novel Entities,No SDG,en,0.9999958401890968,624,624,Bioinformatic workflow fragment discovery leveraging the social-aware knowledge graph.pdf
796ea15de1d6,8 - Novel Entities,No SDG,en,0.9999969923333784,719,719,Multi-view Knowledge Graph Embedding for Entity Alignment.pdf
920f794e4330,8 - Novel Entities,No SDG,en,0.9999962681134932,929,929,Finding interesting correlations with conditional heavy hitters.pdf
8b31f5d289a7,8 - Novel Entities,No SDG,en,0.9999966800292964,575,575,A formal specification framework for smart grid components.pdf
44ccbe284663,8 - Novel Entities,No SDG,en,0.9999975257306696,2099,2099,The technosphere in Earth System analysis_ A coevolutionary perspective.pdf
cd157e34cb94,8 - Novel Entities,SDG14,en,0.9999963483874608,1171,1171,High-resolution modeling of the distribution of surface air pollutants and their intercontinental transport by a global tropospheric atmospheric chemistry source–receptor model (GNAQPMS-SM).pdf
5aaab1fa33a3,8 - Novel Entities,SDG14,en,0.9999983935646932,2366,2366,"Observations and regional modeling of aerosol optical properties, speciation and size distribution over Northern Africa and western Europe.pdf"
958b9231d039,8 - Novel Entities,No SDG,en,0.9999978657356248,1731,1731,Feature and spatial relationship coding capsule network.pdf
a5edeba3c12c,8 - Novel Entities,No SDG,en,0.9999977321952784,996,996,MEAN_ Multi-head Entity Aware Attention Networkfor Political Perspective Detection in News Media.pdf
8491c250c300,8 - Novel Entities,No SDG,en,0.9999977880155329,1146,1146,BioFEG_ Generate Latent Features for Biomedical Entity Linking.pdf
6da292b19012,8 - Novel Entities,No SDG,en,0.99999629463552,950,950,Missing Data Imputation In The Electronic Health Record Using Deeply Learned Autoencoders.pdf
9207674fca1c,8 - Novel Entities,No SDG,en,0.9999984260644827,1141,1141,A Novel Cytotoxic Conjugate Derived from the Natural Product Podophyllotoxin as a Direct-Target Protein Dual Inhibitor.pdf
366136a3d081,8 - Novel Entities,No SDG,en,0.999994757873298,1122,1122,ACO-BTM_ A Behavior Trust Model in Cloud Computing Environment.pdf
e2c710676ba6,8 - Novel Entities,No SDG,en,0.9999987978046438,1313,1313,Literature and Propaganda_ The Structure of Conversion in Schenzinger's Hitlerjunge Quex.pdf
496bf3abc35e,8 - Novel Entities,No SDG,en,0.9999966218518058,616,616,Protocols for self-organization of a wireless sensor network.pdf
8319c3cdd2d2,8 - Novel Entities,SDG15,en,0.999995977443034,1123,1123,Methodology for Lidar Monitoring of Biomass Burning Smoke in Connection with the Land Cover.pdf
e727426383d4,8 - Novel Entities,SDG15,en,0.9999978707931078,2149,2149,Sensitivity of Pollutant Concentrations to the Turbulence Schemes of a Dispersion Modelling Chain over Complex Orography.pdf
